[
  {
    "slug": "shopify",
    "name": "Shopify",
    "description": "Leading e-commerce platform with native UCP checkout support for millions of merchants worldwide.",
    "url": "https://www.shopify.com",
    "category": "platforms"
  },
  {
    "slug": "google-shopping",
    "name": "Google Shopping",
    "description": "Google's shopping platform with UCP integration for AI-agent-driven product discovery and purchase.",
    "url": "https://shopping.google.com",
    "category": "platforms",
    "sourceUrl": "https://blog.google/products-and-platforms/products/shopping/shopping-updates-google-marketing-live/",
    "lastVerified": "2026-07-23",
    "evidenceStatus": "source-verified"
  },
  {
    "slug": "etsy",
    "name": "Etsy",
    "description": "Handmade and vintage marketplace with UCP integration for unique product discovery by AI shopping agents.",
    "url": "https://www.etsy.com",
    "category": "platforms"
  },
  {
    "slug": "wayfair",
    "name": "Wayfair",
    "description": "Home goods and furniture retailer supporting UCP for agent-assisted shopping of large-format items.",
    "url": "https://www.wayfair.com",
    "category": "platforms"
  },
  {
    "slug": "target",
    "name": "Target",
    "description": "Major US retailer with UCP-enabled checkout supporting AI-driven product discovery and same-day delivery.",
    "url": "https://www.target.com",
    "category": "platforms"
  },
  {
    "slug": "walmart",
    "name": "Walmart",
    "description": "Major retailer named by Google as a forthcoming UCP-powered checkout partner in AI Mode and Gemini.",
    "url": "https://www.walmart.com",
    "category": "platforms",
    "ucpStatus": "announced",
    "sourceUrl": "https://blog.google/products/ads-commerce/digital-advertising-commerce-2026/",
    "lastVerified": "2026-07-23",
    "evidenceStatus": "source-verified"
  },
  {
    "slug": "stripe",
    "name": "Stripe",
    "description": "Payment infrastructure provider with first-class UCP payment token exchange and checkout integration.",
    "url": "https://stripe.com",
    "category": "payment-handlers"
  },
  {
    "slug": "adyen",
    "name": "Adyen",
    "description": "Global payment platform supporting UCP transactions across 150+ currencies and local payment methods.",
    "url": "https://www.adyen.com",
    "category": "payment-handlers"
  },
  {
    "slug": "visa",
    "name": "Visa",
    "description": "Global payment network enabling secure UCP payment token exchange across its worldwide card network.",
    "url": "https://www.visa.com",
    "category": "payment-handlers"
  },
  {
    "slug": "mastercard",
    "name": "Mastercard",
    "description": "Payment network with UCP-compatible tokenized payment capabilities for secure agent-driven transactions.",
    "url": "https://www.mastercard.com",
    "category": "payment-handlers"
  },
  {
    "slug": "american-express",
    "name": "American Express",
    "description": "Premium payment network supporting UCP token exchange with enhanced purchase protections for agent-driven commerce.",
    "url": "https://www.americanexpress.com",
    "category": "payment-handlers"
  },
  {
    "slug": "paypal",
    "name": "PayPal",
    "description": "Digital payments platform with UCP checkout and payment token exchange for seamless agent-assisted purchases.",
    "url": "https://www.paypal.com",
    "category": "payment-handlers"
  },
  {
    "slug": "square",
    "name": "Square",
    "description": "Commerce and payments platform bringing UCP-aligned local food ordering to Square sellers through ChatGPT, Claude, and future AI channels.",
    "url": "https://squareup.com",
    "category": "payment-handlers",
    "tags": [
      "payments",
      "restaurants",
      "local-commerce",
      "chatgpt",
      "claude",
      "small-business"
    ],
    "capabilities": [
      "checkout",
      "order-management",
      "payment-token-exchange"
    ],
    "status": "verified",
    "pricing": "paid",
    "docsUrl": "https://developer.squareup.com/docs",
    "ucpEndpoint": null,
    "ucpStatus": "announced",
    "addedDate": "2026-07-01",
    "sourceUrl": "https://squareup.com/us/es/press/claude-chatgpt-integrations"
  },
  {
    "slug": "ucp-sdk",
    "name": "UCP JavaScript SDK (Official)",
    "description": "Official JavaScript/TypeScript SDK for UCP, maintained by the Universal Commerce Protocol organization.",
    "url": "https://github.com/Universal-Commerce-Protocol/js-sdk",
    "category": "developer-tools"
  },
  {
    "slug": "ucp-conformance-test-suite",
    "name": "UCP Conformance Tests (Official)",
    "description": "Official conformance test suite for validating UCP protocol compliance.",
    "url": "https://github.com/Universal-Commerce-Protocol/conformance",
    "category": "developer-tools"
  },
  {
    "slug": "ucp-samples-repository",
    "name": "UCP Samples (Official)",
    "description": "Official sample implementations and examples for the Universal Commerce Protocol.",
    "url": "https://github.com/Universal-Commerce-Protocol/samples",
    "category": "developer-tools"
  },
  {
    "slug": "nike",
    "name": "Nike",
    "description": "Global sportswear brand with UCP checkout enabling AI-assisted shopping across footwear, apparel, and equipment.",
    "url": "https://www.nike.com",
    "category": "merchants",
    "tags": [
      "footwear",
      "apparel",
      "sportswear",
      "direct-to-consumer"
    ],
    "ucpStatus": "live",
    "addedDate": "2026-05-20",
    "sourceUrl": "https://blog.google/products-and-platforms/products/shopping/shopping-updates-google-marketing-live/"
  },
  {
    "slug": "allbirds",
    "name": "Allbirds",
    "description": "Sustainable footwear brand with UCP-enabled checkout for eco-conscious AI-assisted shopping.",
    "url": "https://www.allbirds.com",
    "category": "merchants"
  },
  {
    "slug": "warby-parker",
    "name": "Warby Parker",
    "description": "Eyewear brand supporting UCP checkout with virtual try-on and prescription management capabilities.",
    "url": "https://www.warbyparker.com",
    "category": "merchants"
  },
  {
    "slug": "glossier",
    "name": "Glossier",
    "description": "Beauty and skincare brand with UCP integration for personalized product recommendations via AI agents.",
    "url": "https://www.glossier.com",
    "category": "merchants"
  },
  {
    "slug": "everlane",
    "name": "Everlane",
    "description": "Transparent pricing fashion brand with UCP checkout showcasing radical cost transparency to AI agents.",
    "url": "https://www.everlane.com",
    "category": "merchants"
  },
  {
    "slug": "casper",
    "name": "Casper",
    "description": "Sleep products brand with UCP support for agent-assisted mattress and bedding purchases.",
    "url": "https://casper.com",
    "category": "merchants"
  },
  {
    "slug": "away",
    "name": "Away",
    "description": "Travel and luggage brand with UCP-enabled checkout for AI-assisted travel gear shopping.",
    "url": "https://www.awaytravel.com",
    "category": "merchants"
  },
  {
    "slug": "bombas",
    "name": "Bombas",
    "description": "Comfort-focused sock and apparel brand with UCP checkout supporting subscription and bulk orders.",
    "url": "https://bombas.com",
    "category": "merchants"
  },
  {
    "slug": "outdoor-voices",
    "name": "Outdoor Voices",
    "description": "Activewear brand with UCP integration for AI-assisted athletic apparel shopping.",
    "url": "https://www.outdoorvoices.com",
    "category": "merchants"
  },
  {
    "slug": "thirdlove",
    "name": "ThirdLove",
    "description": "Inclusive lingerie brand with UCP checkout featuring AI-assisted fit finding and size recommendations.",
    "url": "https://www.thirdlove.com",
    "category": "merchants"
  },
  {
    "slug": "google-gemini-ai-shopping",
    "name": "Google Gemini AI Shopping",
    "description": "Google's Gemini shopping experience for conversational product discovery and checkout.",
    "url": "https://gemini.google.com",
    "category": "agent-integrations",
    "sourceUrl": "https://blog.google/products-and-platforms/products/shopping/shopping-updates-google-marketing-live/",
    "lastVerified": "2026-07-23",
    "evidenceStatus": "source-verified"
  },
  {
    "slug": "checkout-directory-api",
    "name": "Checkout.directory API",
    "description": "API service providing a searchable directory of UCP-enabled merchants for agent and application integration.",
    "url": "https://checkout.directory",
    "category": "agent-integrations"
  },
  {
    "slug": "openai-shopping-plugin",
    "name": "ChatGPT Shopping and Instant Checkout",
    "description": "ChatGPT product discovery and Instant Checkout experience, powered by the Agentic Commerce Protocol rather than UCP.",
    "url": "https://openai.com/index/buy-it-in-chatgpt/",
    "category": "agent-integrations",
    "sourceUrl": "https://openai.com/index/buy-it-in-chatgpt/",
    "lastVerified": "2026-07-23",
    "evidenceStatus": "source-verified"
  },
  {
    "slug": "anthropic-commerce-agent",
    "name": "Anthropic Commerce Agent",
    "description": "Claude-powered commerce agent using UCP for safe, transparent AI-assisted shopping with human oversight.",
    "url": "https://www.anthropic.com",
    "category": "agent-integrations"
  },
  {
    "slug": "microsoft-copilot-shopping",
    "name": "Microsoft Copilot Shopping",
    "description": "Microsoft Copilot shopping integration with live UCP support — now includes WooCommerce Brand Agents, mobile checkout, and loyalty program integration.",
    "url": "https://copilot.microsoft.com",
    "category": "agent-integrations",
    "status": "verified",
    "ucpStatus": "live",
    "tags": [
      "woocommerce",
      "loyalty",
      "mobile"
    ],
    "lastVerified": "2026-04-21"
  },
  {
    "slug": "worldpay",
    "name": "Worldpay",